<?xml version="1.0" encoding="UTF-8"?>
<jpaextension xmlns:xsi="http://www.w3.org/2001/XMLSchema-instance" xsi:noNamespaceSchemaLocation="JPAExtension.xsd">

    <jpqlsnippets>
        <snippet id="MY_LIKE_SNIPPET" jpql="like"/>
        <snippet id="nnaammee2" jpql="NAME=:NAME"/>
        <snippet id="nnaammee3" jpql="NAME=:UNIT"/>
    </jpqlsnippets>


    <!-- Definition of available Query Objects-->
    <filter>
        <!--special filter "name" for cluster CAuto is available-->
        <!--select: ...where NAME=test.testfilter.NameFilter.getName()-->
        <query id="query1" jpql="|nnaammee|" annotation="anno1 anno2 anno3 anno4 anno5">
            <filterClass class="org.jpaextension.test.data.Filter1">
                <binding var="UNITNAME" attribute="name"/>
            </filterClass>
        </query>
        <!--select for coordinates-->
        <query id="query2" alias="car" jpql="LATITUDE=:LAT and LONGITUDE=:LONG" annotation="anno6 anno7">
            <filterClass class="org.jpaextension.test.data.Filter2">
                <binding var="LONG" attribute="longitude"/>
                <binding var="LAT" attribute="latitude"/>
            </filterClass>
        </query>
        <!--select only for LATITUDE-->
        <query id="query3" jpql="LATITUDE=:LATONLY">
            <filterClass class="org.jpaextension.test.data.Filter3">
                <binding var="LATONLY" attribute="latitude"/>
            </filterClass>
        </query>
        <query id="query4">
            <filterClass class="org.jpaextension.test.data.Filter1"/>
        </query>
        <query id="query5" alias="c">
            <filterClass class="org.jpaextension.test.data.Filter2"/>
            <fetch property="besitzer"/>
            <fetch property="sparePart" joinType="left"/>
        </query>
        <query id="MyOIQuery" alias="oi" jpql="oi.creatorId=:CID and oi.nameTxt=:NT" annotation="anno6 anno7">
            <filterClass class="org.jpaextension.test.data.SomeFilter">
                <binding var="CID" attribute="creatorId"/>
                <binding var="NT" attribute="nameTxt"/>
            </filterClass>
        </query>
        <query id="MyOIQuery2" alias="oi" jpql="oi.creatorId=:CID and oi.nameTxt=:NT" annotation="anno6 anno7">
            <filterClass class="org.jpaextension.test.data.SomeJavaTestFilter">
                <binding var="CID" attribute="creatorId"/>
                <binding var="NT" attribute="nameTxt"/>
            </filterClass>
        </query>
        <query id="FindObjectItemFromName"
               jpql="select oi from ObjectItem oi where oi.nameTxt like ?1"/>

        <query id="FindObjectItemFromNameWithFilter" alias="oi" jpql="oi.nameTxt |MY_LIKE_SNIPPET| :N" orderby="oi.nameTxt">
            <filterClass class="org.jpaextension.test.NameFilter">
                <binding var="N" attribute="name"/>
            </filterClass>
        </query>
    </filter>

</jpaextension>
